{
  "task_id": "example-records-match-lead",
  "status": "failed",
  "worker": "openquad-records",
  "capability": "records.match",
  "task_type": "match_record",
  "result": {
    "message": "Example result shape; current stub runner returns not_implemented."
  },
  "policy_decision": {
    "decision": "allowed",
    "reason": "example policy decision",
    "policy_version": "v0.1"
  },
  "evidence": [],
  "provenance": {
    "example": true
  },
  "artifacts": [],
  "errors": [
    {
      "code": "not_implemented",
      "message": "No real connector runner is implemented in v0.1."
    }
  ]
}
