{
  "task_id": "nereus-task-doc-convert-example-001",
  "status": "succeeded",
  "worker": "grotto-documents",
  "capability": "documents.convert",
  "task_type": "convert_pdf_to_text",
  "result": {
    "message": "PDF text extraction succeeded.",
    "source_uri": "file:///home/node/.openclaw/workspace/inputs/inquiry.pdf",
    "page_count": 3,
    "text_size_bytes": 4821,
    "text_sha256": "a1b2c3d4e5f6a1b2c3d4e5f6a1b2c3d4e5f6a1b2c3d4e5f6a1b2c3d4e5f6a1b2",
    "artifact_count": 2
  },
  "policy_decision": {
    "decision": "allowed",
    "reason": "Read-only deterministic document conversion. No external network, no secrets.",
    "policy_version": "v0.1",
    "hints": {
      "side_effect_classes": ["read_only", "local_artifact_write"]
    }
  },
  "evidence": [
    {"tool": "pdfinfo", "result": {"Title": "Inquiry Letter", "Pages": "3", "Producer": "libreoffice"}, "ok": null},
    {"tool": "pdftotext", "ok": true}
  ],
  "provenance": {
    "orchestrator": "nereus",
    "tenant_id": "demo-tenant",
    "workflow_id": null,
    "submitted_by": "nereus-control-plane"
  },
  "artifacts": [
    {
      "kind": "text",
      "uri": "file:///home/node/.openclaw/workspace/tasks/nereus-task-doc-convert-example-001/artifacts/output.txt",
      "sha256": "a1b2c3d4e5f6a1b2c3d4e5f6a1b2c3d4e5f6a1b2c3d4e5f6a1b2c3d4e5f6a1b2",
      "size_bytes": 4821,
      "content_type": "text/plain",
      "metadata": {}
    },
    {
      "kind": "json",
      "uri": "file:///home/node/.openclaw/workspace/tasks/nereus-task-doc-convert-example-001/artifacts/metadata.json",
      "sha256": "b2c3d4e5f6a1b2c3d4e5f6a1b2c3d4e5f6a1b2c3d4e5f6a1b2c3d4e5f6a1b2c3",
      "size_bytes": 312,
      "content_type": "application/json",
      "metadata": {}
    }
  ],
  "errors": []
}
